title,summary,prep_time,cook_time,servings,ingredients,instructions,calories,carbohydrates,protein,fat,saturated_fat,polyunsaturated_fat,monounsaturated_fat,trans_fat,cholesterol,sodium,potassium,fiber,sugar,vitamin_a,vitamin_c,calcium,iron,image_url,Vegetarian,Low-Purine,Low-fat/Heart-Healthy,Low-Sodium,Lactose-free,Peanut Allergy,Shellfish Allergy,Fish Allergy,Halal or Kosher
Buckwheat Pancakes,"Buttermilk adds a tang to brighten earthy buckwheat flour for a pancake recipe that's a keeper. Buckwheat has zero gluten in it, so if you are at all gluten-sensitive, you shouldn't have a problem with buckwheat.

",5 minutes,20 minutes,4 servings,"100 g buckwheat flour; 100 g all-purpose flour; 3 tablespoons sugar; 1/2 teaspoon salt; 1 teaspoon baking soda; 1 egg egg; 475 ml buttermilk; 3 tablespoons (42g) unsalted butter,; coating the pan  Vegetable oil","Preheat the skillet:Heat a well-seasoned griddle, cast iron skillet, or stick-free pan on medium heat. The pan or griddle should be ready for the batter as soon as it is mixed. | Make the pancake batter:Whisk together the dry ingredients—the flours, sugar, salt, baking soda—in a large bowl.Beat the egg with a fork and stir it into half of the buttermilk. Add the melted butter and stir. Add the egg mixture to the dry ingredients, then slowly add more buttermilk as needed to get a thick but pourable consistency for your batter (you may not need all of the buttermilk, depending on what type of buttermilk you are using and the brand of flour).Stir only until everything is combined. Do not over-mix! A few lumps are fine.Simply Recipes / Sally VargasSimply Recipes / Sally VargasSimply Recipes / Sally Vargas | Ladle the batter onto the hot pan:Put a small amount (1/2 teaspoon) of vegetable oil on the pan or griddle and spread it around with a paper towel to coat.Ladle the batter onto the hot surface to the desired size, about 4 to 5 inches wide. (A 1/4 cup measure will ladle about a 4-inch pancake.) Reduce the heat to medium-low. Allow the pancake to cook for 2 to 3 minutes on this first side.Simply Recipes / Sally Vargas | Flip the pancakes:Watch for bubbles on the surface of the pancake. When air bubbles start to rise to the surface at the center of the pancake, flip the pancake. Cook for another 1 to 2 minutes, or until nicely browned.Simply Recipes / Sally Vargas | Keep the finished pancakes warm:Keep your pancakes warm on a rack in the oven set on ""warm,"" or stack them on a plate and cover with a towel as you make more. Spread more oil on the pan as needed between batches of pancakes.Serve with butter and maple syrup.Did you love the recipe? Leave us stars below!Simply Recipes / Sally Vargas",385,52 19%,11,15 20%,7 34%,0,0,0,74 25%,835 36%,377 8%,3 11%,16,0,1 6%,166 13%,2 14%,https://www.simplyrecipes.com/thmb/2hoolWirYJLPFNm36eRf6rgdOaU=/1500x0/filters:no_upscale():max_bytes(150000):strip_icc()/__opt__aboutcom__coeus__resources__content_migration__simply_recipes__uploads__2011__04__buckwheat-pancakes-vertical-a-1600-9f01fd841cfe4b14b85646e832b0ceba.jpg,TRUE,TRUE,FALSE,FALSE,FALSE,TRUE,TRUE,TRUE,TRUE
Goetta Recipe (Cincinnati Breakfast Classic),Goetta is essentially a simple pork and beef sausage stretched out with oats. It’s sliced and griddled until crispy and most often served at breakfast with eggs and toast. ,20 minutes,180 minutes,22 servings,4 cups water; 2 1/2 cups steel-cut oats; 10 g salt; 1 pound ground pork; 1 pound ground beef; 2 teaspoons poultry seasoning; 2 teaspoons onion powder; 2 teaspoons garlic powder; 1 teaspoon white pepper; 1/4 teaspoon cayenne pepper; 1/4 teaspoon ground nutmeg; 4 cups low-sodium beef stock; 2 bay leaves bay leaves,"Cook the oats:In a large, heavy-bottomed pot, bring the water, oats, and 1 teaspoon of the salt to a boil over high heat. Reduce to a simmer and cook uncovered, stirring often with a wooden spoon, until very thick and creamy, about 30 minutes.Simply Recipes / Ciara Kehoe | Mix the meat and seasonings:In the bowl of an electric stand mixer fitted with the paddle attachment, combine the ground pork and beef, seasonings, and remaining 1 teaspoon salt. Mix on low speed until combined, about 1 to 2 minutes.With the machine running on low, slowly pour in 2 cups of the beef stock and mix until sticky, about 2 minutes. Mixing the meats until they are sticky helps form a protein bond that’ll make your finished goetta less crumbly and have a more sausage-like texture.TipIf you don’t have a stand mixer, you can thoroughly knead the mixture together by hand.Simply Recipes / Ciara KehoeSimply Recipes / Ciara Kehoe | Add the meat mixture and stock and cook until very thick:Transfer the meat mixture to the pot with the oats. Add the remaining beef stock and stir well to make a light pink sludge. Add the bay leaves, then raise the heat to medium-high and bring to a simmer, stirring constantly with a wooden spoon.Reduce the heat as low as it can go and cook, uncovered, 1 to 2 hours, stirring every 5 minutes or so to prevent the oats from sticking to the bottom and scorching. It’ll slowly turn brown and then, as the liquid evaporates, it’ll look less like oatmeal and more like a chunky, brownish-gray peanut butter.It should require more and more effort to stir the longer it cooks (if in doubt, cook longer). When it’s ready, it’ll be quite stiff, and you’ll easily see the bottom of the pot when you drag the spoon through the mixture.Taste and adjust the seasoning, if needed; it should be salty the way sausage is salty. Remove the bay leaves and set the pot aside for now.Simply Recipes / Ciara KehoeSimply Recipes / Ciara KehoeSimply Recipes / Ciara Kehoe | Fill the loaf pans:Line the bottoms of two 8 1/2x4 1/2 or 9x5-inch loaf pans with parchment. Grease the pans and parchment with cooking spray.Divide the mixture between the pans and smooth the tops. Let the pans cool on the counter for at least 1 hour, then refrigerate, uncovered, for at least 12 hours to set.TipLeaving the pan uncovered allows the goetta to form a skin on top that helps it keep its shape when you slice it.Simply Recipes / Ciara KehoeSimply Recipes / Ciara Kehoe | Wrap and store:Slide a thin metal spatula between the parchment and the goetta to loosen it, then unmold the loaf and wrap it well in plastic wrap. Refrigerate for up to 1 week or freeze for up to 1 year.TipFor easy portioning, slice the goetta before freezing. Wrap several slices tightly in plastic wrap and then place the bundles in a large freezer bag so you can remove only as much goetta as you need at a time. Thaw the goetta overnight in the refrigerator. | Fry the goetta to serve:Even though the goetta is fully cooked, it’s always served sliced and fried or griddled. Cut the loaf into 1/2-inch slices.Heat 1 tablespoon of vegetable oil or bacon fat in a skillet (preferably nonstick or cast iron) over medium-high heat. Add the goetta, being careful not to crowd the pan, and cook 5 to 10 minutes per side, disturbing the goetta as little as possible so you don’t break up the crispy brown crust as it forms. You may need to lower the heat of the pan bit by bit to keep it from scorching.Love the recipe? Leave us stars and a comment below!Simply Recipes / Ciara KehoeSimply Recipes / Ciara KehoeSimply Recipes / Ciara KehoeSimply Recipes / Ciara Kehoe",128,7 3%,10,7 8%,2 12%,0,0,0,28 9%,294 13%,163 3%,1 4%,0,0,0 1%,18 1%,1 6%,https://www.simplyrecipes.com/thmb/NvCTtp23_FphMFjG6b-jEHXYM-U=/1500x0/filters:no_upscale():max_bytes(150000):strip_icc()/Simply-Recipes-Goetta-LEAD-4-84fecc377bb341a595881c8c358239b2.jpg,FALSE,FALSE,FALSE,FALSE,TRUE,TRUE,TRUE,TRUE,FALSE
Sheet Pan Fried Eggs,"The easiest way to make a bunch of fried eggs at once.

",20 minutes,5 minutes,"5
to 10 servings",10 large eggs large eggs; Olive oil Olive oil Olive oil; 1/4 teaspoon salt and pepper,"Preheat the oven to 425°F:Arrange a rack in the middle of the oven. While the oven is preheating, place a rimmed baking sheet on the middle rack and let the sheet pan preheat for 15 minutes. | Prepare the eggs and oil the sheet pan:Meanwhile, crack the eggs in a liquid measuring cup. Once the sheet pan is preheated, remove it from the oven. Working quickly, drizzle olive oil onto the hot sheet pan, coating it generously to prevent sticking.Simply Recipes / Photo by Victor Protasio / Food Styling by Ruth Blackburn / Prop Styling by Claire SpollenSimply Recipes / Photo by Victor Protasio / Food Styling by Ruth Blackburn / Prop Styling by Claire Spollen | Bake and serve:Pour the eggs, 1 at a time, beside each other onto the sheet pan (careful not to crack yolks).Return the sheet pan to the oven and bake until the egg whites are set but the yolks are still jiggly, about 5 minutes, or until desired doneness. Sprinkle with salt and pepper, and serve.Love the recipe? Leave us stars and a comment below!Simply Recipes / Photo by Victor Protasio / Food Styling by Ruth Blackburn / Prop Styling by Claire SpollenSimply Recipes / Photo by Victor Protasio / Food Styling by Ruth Blackburn / Prop Styling by Claire SpollenSimply Recipes / Photo by Victor Protasio / Food Styling by Ruth Blackburn / Prop Styling by Claire Spollen",84,0 0%,6,6 8%,2 9%,0,0,0,186 62%,101 4%,69 1%,0 0%,0,0,0 0%,28 2%,1 5%,https://www.simplyrecipes.com/thmb/nxG4sTmiHdW4pV5h9VjDVx5_uC0=/1500x0/filters:no_upscale():max_bytes(150000):strip_icc()/Simply-Recipes-Sheet-Pan-Fried-Eggs-METHOD-6-40385d1954af41a689f9fe788c77910d.jpg,TRUE,TRUE,FALSE,FALSE,TRUE,TRUE,TRUE,TRUE,TRUE
Banana Chocolate Chip Muffins,"Turn overripe bananas into crowd-pleasing banana chocolate chip muffins. A couple of thoughtful techniques plus mashed banana make these chocolate-studded muffins tender, moist, and hard to resist.",10 minutes,17 minutes,12 servings,"236 g all-purpose flour; 1 teaspoon baking powder; 1/2 teaspoon baking soda; 1/2 teaspoon kosher salt; 150 g granulated sugar; 84 g unsalted butter; 3 tablespoons oil; 1 large egg large egg; 1 1/4 teaspoons vanilla extract; 3/4 cup mashed overripe banana; 3/4 cup buttermilk; 185 g semi-sweet chocolate chips, divided","Combine the flour, leavening, and salt:In a small bowl, whisk together the flour, baking powder, baking soda, and salt to combine and set aside.Simply Recipes / Mark Beahm | Mix the sugar, butter, and oil:In a large bowl, whisk together the sugar, melted butter, and oil until well combined, about 15 seconds.Simply Recipes / Mark Beahm | Add the remaining wet ingredients:Add the egg and vanilla extract to the butter mixture. Vigorously whisk until the egg is completely broken up and the mixture is well combined and lightened in color, 30 seconds to 1 minute.Add the mashed banana to the butter mixture and whisk until fully combined, about 30 seconds. There shouldn’t be any big chunks of banana. Add the buttermilk and whisk until combined.Simply Recipes / Mark BeahmSimply Recipes / Mark Beahm | Combine the wet and dry ingredients:Add the flour mixture to the bowl with the wet ingredients and whisk until just combined and no dry bits remain. It’s okay if the batter looks a little lumpy.Add 3/4 cup of the mini semi-sweet chocolate chips to the batter, reserving the remaining 1/4 cup for topping the muffins. Gently fold the mini chocolate chips into the batter just until the chips are evenly dispersed. Don’t overmix!Simply Recipes / Mark BeahmSimply Recipes / Mark Beahm | Rest the batter:Cover the bowl with plastic wrap and allow the batter to rest at room temperature for 1 hour. Resting the batter allows the flour to hydrate which in turn reduces some of the spread of the muffin tops and helps create even, rounded tops.If you’re short on time, you can skip this step. | While the batter rests, preheat the oven and prepare the muffin tins:Arrange a rack in the center of the oven. Preheat the oven to 400°F.Line every other cavity of 2 standard-size muffin tins with paper liners. There should be 12 total lined cavities. Allowing this space helps the muffins to rise and bake more evenly and reduces the likelihood of the muffins baking into each other. If you only own one muffin tin, you can fill each cavity and bake them all side-by-side.Simply Recipes / Mark Beahm | Divide the batter:Using a 2 1/2-inch scoop (about 1/3 cup), scoop 12 portions of batter into the lined cavities of the muffin tin, filling slightly over 3/4 full. Depending on the capacity of your muffin pans, you might get 13 muffins. Top each muffin with the remaining mini chocolate chips.Simply Recipes / Mark Beahm | Bake and cool:To yield maximum oven spring (and in turn a better rise and texture), the muffins are baked at 2 temperatures.Arrange the pans on the middle rack of the oven. Bake the muffins at 400°F for 9 minutes. Without opening the oven door, lower the temperature to 350°F and bake for 4 more minutes. Rotate the pans and bake until the muffins are golden brown around the edges, spring back when gently poked, and a toothpick inserted into the center comes out clean, 4 to 6 minutes more (17 to 19 minutes total bake time).Let the muffins cool slightly in the pans set over a wire rack for a few minutes. Transfer the muffins to a wire rack to finish cooling. Serve warm or at room temperature.Leftover muffin tops can be stored in an airtight container at room temperature for up to 3 days.TipI love to reheat leftover muffins in the microwave for a few seconds or until the chocolate is melted again.Love the recipe? Leave us stars below!Simply Recipes / Mark BeahmSimply Recipes / Mark Beahm",301,41 15%,4,15 19%,7 34%,0,0,0,31 10%,184 8%,159 3%,2 6%,23,0,1 7%,53 4%,2 9%,https://www.simplyrecipes.com/thmb/QctasywZgn6oh3iYFznMyJpCC4k=/1500x0/filters:no_upscale():max_bytes(150000):strip_icc()/Simply-Recipes-Banana-Chocolate-Muffins-LEAD-02-995c56472a2d40cbb831ad079f645bbc.jpg,TRUE,TRUE,FALSE,FALSE,FALSE,TRUE,TRUE,TRUE,TRUE
3-Ingredient Banana Pancakes,"Turn your overripe bananas into banana pancakes with just three ingredients. This recipe is flexible—make it gluten-free or adjust the servings based on how many bananas are available.

",5 minutes,20 minutes,"2
to 4 servings",4 bananas bananas; 4 eggs eggs; 1 cup all-purpose flour; 8 teaspoons butter,"Prepare the banana batter:Add the bananas to a bowl and mash with a fork until there are no chunks. Add the eggs and flour to the bowl and mix until combined.Simply Recipes / Frank TiuSimply Recipes / Frank TiuSimply Recipes / Frank Tiu | Cook the pancakes:Melt about 2 teaspoons of butter in a nonstick pan over medium heat. Add a quarter of the pancake batter and use a silicone spatula to gently spread the batter from the center towards the edges to create a circular shape about 6 inches across.Cook one side for 2 minutes and gently slide your spatula underneath to see if it is sticking to the pan. If it is still sticking, continue cooking for another minute. If it slides smoothly and is browned in spots, flip the pancake to the other side and cook until both sides separate from the pan, are nicely browned, and the edges lift slightly, another 2 to 3 minutes.Carefully wipe out the pan with a paper towel. Repeat with the remaining pancake batter, adding more butter to grease the pan each time.Simply Recipes / Frank TiuSimply Recipes / Frank TiuSimply Recipes / Frank Tiu | Serve:Garnish with your favorite pancake toppings and serve.Leftover batter can be kept in an airtight container in the fridge for up to 2 days. Let any leftover cooked pancakes cool before storing in an airtight container in the fridge for up to 3 days. For the best leftovers, preheated an oven or toaster oven to 350°F. Place the pancakes on a baking sheet lined with a cooling rack and bake for 8 to 10 minutes.Did you love the recipe? Give us some stars and leave a comment below!Simply Recipes / Frank Tiu",333,51 19%,11,10 13%,5 24%,0,0,0,199 66%,111 5%,526 11%,4 14%,15,0,10 51%,40 3%,3 15%,https://www.simplyrecipes.com/thmb/dBq36_WRfz3P-qdgzFFUeHYSKPQ=/1500x0/filters:no_upscale():max_bytes(150000):strip_icc()/Simply-Recipes-3-Ingredients-Banana-Pancake-LEAD-03-d253a26beb564da8894547b402378d7f.jpg,TRUE,TRUE,TRUE,FALSE,FALSE,TRUE,TRUE,TRUE,TRUE
Microwave Bacon,"You don't need a gadget, just a plate and paper towels for crispy bacon in minutes.",1 minutes,5 minutes,2 servings,4 slices bacon,"Put the bacon on a paper towel-lined plate:Line a microwave-safe plate with 2 layers of paper towels. Place the bacon on top, without overlapping. Cover with another 2 layers of paper towels.Simply Recipes / Alison BickelSimply Recipes / Alison Bickel | Microwave the bacon:Microwave on HIGH for 2 minutes for regular bacon or 2 minutes 30 seconds for thick-cut bacon.Simply Recipes / Alison Bickel | Flip the bacon:Peel back the top layer of paper towels and use tongs to flip the bacon strips. Microwave another 2 minutes for regular and 2 minutes 30 seconds for thick-cut, until the bacon is deep golden-brown and crispy.TipFor crispier bacon, continue microwaving 30 seconds at a time until desired consistency is reached.Simply Recipes / Alison BickelSimply Recipes / Alison Bickel | Serve:Remove the bacon from the paper towels, being mindful of hot grease, and place on a clean plate. Serve.Did you love the recipe? Leave us stars below!Simply Recipes / Alison Bickel",108,0 0%,8,8 10%,3 14%,0,0,0,23 8%,387 17%,115 2%,0 0%,0,0,0 0%,3 0%,0 1%,https://www.simplyrecipes.com/thmb/FJfLY4LK_-MmrB157FzmN_0Nu9E=/1500x0/filters:no_upscale():max_bytes(150000):strip_icc()/Simply-Recipes-Microwave-Bacon-LEAD-2-f6b99ba91e134c7587a63abe0bb97384.jpg,FALSE,FALSE,FALSE,FALSE,TRUE,TRUE,TRUE,TRUE,FALSE
Blueberry Muffin Tops,"Skip the specialty pan! These blueberry muffin tops are baked freeform on a baking sheet for tender little berry-packed pillows topped with streusel, perfect for any time of day.",15 minutes,12 minutes,12 servings,182 g all-purpose flour; 1 1/4 teaspoons baking powder; 1/2 teaspoon baking soda; 1/2 teaspoon kosher salt; 56 g unsalted butter; 135 g granulated sugar; 1 1/4 teaspoons vanilla extract; 1 large egg large egg; 4 teaspoons oil; 1/2 cup buttermilk; 7 1/4 ounces fresh blueberries,"Prepare the batter:In a small bowl, whisk together 1 1/3 cups flour, baking powder, baking soda, and salt to combine and set aside.Add the butter, sugar, and vanilla extract to the bowl of a stand mixer fitted with the paddle attachment or a large mixing bowl using a hand mixer. Beat together on medium speed until fully combined, smooth, and creamy, about 1 minute. Stop and scrape the bowl with a rubber spatula as needed.Simply Recipes / Mark BeahmSimply Recipes / Mark Beahm | Add the egg and oil:Add the egg and beat together on medium speed until fully incorporated. The mixture may look like it’s on the cusp of separating. That’s okay.Add the oil and beat together on medium speed, scraping as needed, until fully incorporated.Simply Recipes / Mark BeahmSimply Recipes / Mark Beahm | Combine the wet and dry ingredients:Add 1/3 of the flour mixture to the bowl with the butter mixture and beat on low until just combined.Add 1/2 of the buttermilk and beat on low until just combined. Repeat, alternating the remaining flour mixture and buttermilk, scraping the bowl between each addition. Some dry bits remaining are okay. Do not overmix the batter.Simply Recipes / Mark BeahmSimply Recipes / Mark Beahm | Toss the berries and fold into the batter:Add the blueberries to the bowl you used for the flour mixture. Sprinkle the remaining 1 teaspoon of flour over the blueberries and gently toss to coat.Add the coated blueberries to the batter. Gently fold the blueberries into the batter until any remaining dry bits have been incorporated and the blueberries are evenly distributed. Do not overmix.Simply Recipes / Mark BeahmSimply Recipes / Mark Beahm | Rest the batter:Cover the bowl with plastic wrap and allow the batter to rest at room temperature for 30 minutes or up to 1 hour. This rest helps keep the muffin tops from spreading too much and creates a better dome on top.Simply Recipes / Mark Beahm | Preheat the oven and prepare the streusel:While the batter rests, arrange the racks in the top and bottom thirds of the oven. Preheat the oven to 400°F. Line two large rimmed baking sheets with parchment paper.To make the streusel, add the flour, rolled oats, brown sugar, and salt to a small bowl and mix. Add the melted butter and vanilla extract. Stir the mixture together until most of the flour mixture is hydrated. There will still be some dry bits.Using your hands, work the streusel until no dry bits remain. The mixture should be crumbly but able to hold together in a clump when you squeeze it. Squeeze together small amounts of the mixture to form little streusel clumps.Simply Recipes / Mark BeahmSimply Recipes / Mark Beahm | Portion out the muffin tops and top with streusel:Using a 2-inch scoop, scoop out 6 portions of batter onto each baking sheet. To avoid the muffin tops baking into each other, stagger them on the baking sheet and leave a few inches between each one.Very gently press (you don’t want to flatten them) heaping tablespoons of the streusel on top of each muffin top scoop.Simply Recipes / Mark BeahmSimply Recipes / Mark Beahm | Bake the muffin tops:Arrange the muffin tops in the top and bottom thirds of the oven. Bake at 400°F for 7 minutes until the muffin top is puffed and the structure is set. Rotate the pans from front to back and top to bottom. Bake for an additional 4 to 6 minutes until the muffin tops are golden on top, golden brown around the edges, and a toothpick inserted into the center comes out clean (11 to 13 minutes total).Simply Recipes / Mark Beahm | Cool and serve:Let the muffin tops cool on the pans for 5 minutes. Transfer to a wire rack to finish cooling. If desired, place a spoonful of powdered sugar in a sifter and lightly dust each muffin top. Serve warm or at room temperature.Leftover muffin tops can be stored in an airtight container at room temperature for up to 3 days.Love the recipe? Leave us stars below!Simply Recipes / Mark BeahmSimply Recipes / Mark Beahm",259,39 14%,4,10 13%,5 25%,0,0,0,36 12%,237 10%,80 2%,1 5%,19,0,2 9%,55 4%,1 8%,https://www.simplyrecipes.com/thmb/u9Z1-7cmPBqafebs3CxVy9KhlXg=/1500x0/filters:no_upscale():max_bytes(150000):strip_icc()/SimplyRecipes_BlueberryMuffinTops-LEAD-4-b138a211a5544a819ad8cb6a90701923.jpg,TRUE,TRUE,FALSE,FALSE,FALSE,TRUE,TRUE,TRUE,TRUE
