title,summary,prep_time,cook_time,servings,ingredients,instructions,calories,carbohydrates,protein,fat,saturated_fat,polyunsaturated_fat,monounsaturated_fat,trans_fat,cholesterol,sodium,potassium,fiber,sugar,vitamin_a,vitamin_c,calcium,iron,image_url,Vegetarian,Low-Purine,Low-fat/Heart-Healthy,Low-Sodium,Lactose-free,Peanut Allergy,Shellfish Allergy,Fish Allergy,Halal or Kosher
Thai Chicken Salad with Spicy Peanut Dressing,"This Thai Chicken Salad with Spicy Peanut Dressing is sure to rock your taste buds! It's a medley of cubed chicken pieces, chopped peanuts, fried wonton strips, and crunchy salad ingredients with a creamy and spicy peanut dressing that's full of flavor and texture. Perfect for a hearty lunch or dinner!",20 minutes,5 minutes,4,"4 (4 ounces each) boneless chicken breast; salt and pepper to taste; 1 package (12 ounces) wonton wrappers, sliced into thin strips; 1 cup canola oil; 1 Romaine lettuce heart, chopped; head cabbage, chopped; head red cabbage, shredded; 1 large carrot, peeled and shredded; red bell pepper, seeded and chopped; 2 green onions, chopped; cup peanuts, chopped; 3 tablespoons smooth peanut butter; 2 tablespoons red wine vinegar; 1 tablespoon ginger, peeled and finely grated; 1 clove garlic, finely minced; teaspoon Sriracha sauce; juice of 1 lemon; 2 tablespoons soy sauce; 2 tablespoons honey; 1 teaspoon sugar; 1 tablespoon sesame oil; 3 tablespoons canola oil","In a heavy-bottomed pot over medium heat, place chicken in a single layer and enough water to cover. Add salt and pepper to taste. Bring to a boil and then reduce heat to barely a simmer. | Cover and continue to simmer for about 10 minutes. Turn off the heat and allow the chicken to cook completely in hot water for about 15 to 20 minutes. | Remove chicken from the liquid, and refrigerate to completely cool. Cut the breasts into 1-inch cubes. | In skillet over medium heat, heat oil. Add wonton strips and cook for about 1 to 2 minutes or until golden and crisp. Remove from pan and drain on paper towels. Set aside. | In a large bowl, combine chicken, lettuce, cabbage, red cabbage, carrots, bell pepper and green onions. | When ready to serve, add peanut dressing and gently toss to combine. Top with fried wontons and peanuts. | With hands, squeeze ginger to extract juice. | In a bowl, combine peanut butter, vinegar, garlic, Sriracha sauce, ginger juice, lemon juice, soy sauce, honey, sugar, sesame oil and canola oil. Whisk together until well-blended and smooth.",662,32,58,35,5,0,0,0,145,912,1448,7,18,4447,96,104,3,https://www.kawalingpinoy.com/wp-content/uploads/2015/02/thai-chicken-salad-1-158x158.jpg,FALSE,FALSE,FALSE,FALSE,FALSE,FALSE,TRUE,TRUE,FALSE
Chicken Binakol,"Chicken Binakoe is a classic Filipino soup made with coconut juice, papaya, spinach, and lemongrass. It's delicious, refreshing, and perfect for cold weather!",15 minutes,45 minutes,4,"2 stalks lemongrass; 1 tablespoon canola oil; 1 onion, peeled and sliced thinly; 3 cloves garlic, peeled and minced; 1 thumb-size ginger, peeled and julienned; 1 (about 3 to 4 pounds) whole native chicken, cut into serving parts; 1 tablespoon fish sauce; 4 cups coconut juice; 1 cup young coconut meat (buko); 1 green papaya, peeled and cut into cubes; 1 bunch spinach, stemmed and leaves separated","Cut the stem and leaf ends of the lemongrass. Peel a few layers to get to the white part. Cut into 2-inch lengths and pound until with the back of a knife to release flavor. Set aside. | In a pot over medium heat, heat oil. Add onions, garlic, and ginger. Cook until softened. | Add chicken and cook until color changes and juices run clear. | Add fish sauce and cook for about 1 minute. | Add coconut juice and bring to a boil, skimming any scum that may float on top. | Add lemongrass. | Lower heat, cover and continue to cook for about 20 to 25 minutes or until chicken is cooked through. | Add papaya and cook for about 3 to 5 minutes or until tender. | Add coconut meat and cook until heated through. | Season with salt and pepper to taste. | Add spinach leaves, pushing down into the broth. Turn off heat and cover pot. Serve hot.",575,29,36,36,14,0,0,0,122,799,1709,8,15,8921,82,193,6,https://www.kawalingpinoy.com/wp-content/uploads/2016/04/Chicken-Binakol-4-158x158.jpg,FALSE,FALSE,FALSE,FALSE,TRUE,TRUE,TRUE,FALSE,TRUE
Tinolang Manok sa Upo,"Tinolang Manok sa Upo is a refreshing chicken soup with bottle gourd and spinach cooked in a ginger-flavored broth. It's filling, delicious, and perfect for cold weather!",10 minutes,25 minutes,4,"1 tablespoon canola oil; 1 onion, peeled and sliced thinly; 3 cloves garlic, peeled and minced; 2 thumb-sized ginger, peeled and julienned; 2 pounds bone-in chicken, cut into 3-inch pieces; 2 tablespoons fish sauce; 4 cups water; 1 large upo, peeled and cut into 2-inch wedges (about 2 cups); 1 bunch fresh spinach leaves, stems trimmed; salt and pepper to taste","In a pot over medium heat, heat oil. Add onions, garlic, and ginger and cook until softened. | Add chicken and cook, stirring occasionally, for about 2 to 4 minutes or until color changes and juices run clear. | Add fish sauce and cook, stirring occasionally, for about 1 to 2 minutes. | Add water and bring to a boil, skimming scum that floats on top. | Lower heat, cover, and simmer for about 15 to 20 minutes or until chicken is cooked through. | Add upo and cook for about 2 to 4 minutes or until tender yet crisp. | Add spinach and push down into the broth. Turn off heat and cover until leaves are just wilted. | Season with salt and pepper to taste. serve hot.",507,11,35,36,9,0,0,0,189,939,1058,2,2,8121,27,147,4,https://www.kawalingpinoy.com/wp-content/uploads/2016/05/tinolang-manok-upo-4-158x158.jpg,FALSE,FALSE,FALSE,FALSE,TRUE,TRUE,TRUE,FALSE,TRUE
Bulalo Mami,Bulalo Mami is a delicious mash-up of two popular Filipino dishes. This tasty soup combines the hearty flavors of beef bulalo and mami noodles for a filling one-pot meal. Perfect for cold weather!,15 minutes,180 minutes,4,"water; 3 pounds bone-in beef shanks; 1 onion; 1 tablespoon peppercorns; 2 tablespoons fish sauce; salt to taste; 1 napa cabbage; 1 package (16 ounces) fresh egg noodles; green onion; 1 head garlic, peeled and minced; cup canola oil","In a large pot, combine beef shanks and enough cold water to cover. Bring to a boil. | Drain beef and rinse under cold water to remove impurities. Discard the liquid and rinse the pot. | In the pot, return meat and enough cold water to cover. Bring to a boil, skimming scum that accumulates on top. | When the broth has cleared, add onions, garlic, peppercorns, and fish sauce. | Lower heat to low, cover, nd cook at a bare simmer for about 3 hours or until meat is fork-tender. Season with salt to taste. | In a medium pot over medium heat, bring about 2 cups water to a boil. Add cabbage and cook for about 1 to 2 minutes or until tender yet crisp. | With a slotted spoon, remove from heat and immediately plunge into a bowl of iced water. Let cool completely and drain well. | In another pot over medium heat, bring about 2 cups water to a boil. Add egg noodles and cook for about 10 to 15 seconds. Remove from water and rinse with cold water. Drain well. | Divide egg noodles into serving bowls. Add beef shanks and cabbage. Pour hot broth. Garnish with fried garlic bits and chopped onions. Serve hot. | In a small pan over low heat, heat oil. Add garlic and cook until golden and crisp. | With a slotted spoon, remove toasted garlic and drain on paper towels.",749,14,78,42,7,0,0,0,133,817,1978,4,5,736,64,274,9,https://www.kawalingpinoy.com/wp-content/uploads/2014/05/bulalo-mami-6-158x158.jpg,FALSE,FALSE,FALSE,FALSE,TRUE,TRUE,TRUE,FALSE,TRUE
Kake Udon,Kake Udon is a simple Japanese noodle soup made of udon and a dashi-flavored stock. This delicious recipe is ready in just minutes with simple ingredients.,5 minutes,5 minutes,2,"4 cups dashi; 2 tablespoons soy sauce; 2 tablespoons mirin; 2 tablespoons sake; salt; 2 packs (7 ounces each) fresh udon noodles; green onions, chopped; shichimi togarashi (Japanese 7-spice); grated ginger (optional)","Prepare udon according to package directions and drain well. | Rinse under cold running water to remove excess starch. Then run under hot water to warm up. | In a pot, combine dashi, soy sauce, mirin, sake, and salt. Bring to a boil and reduce to a simmer for about 3 minutes. | Place udon in bowls and ladle the broth. | Top with spring onions, shichimi togarashi, and grated ginger, if desired. Serve hot.",134,11,12,3,1,0,0,0,0,2688,458,1,5,0,0,146,1,https://www.kawalingpinoy.com/wp-content/uploads/2014/10/kake-udon-6-158x158.jpg,TRUE,TRUE,TRUE,FALSE,TRUE,TRUE,TRUE,TRUE,TRUE
Bulalo,"Bulalo, with tender beef shanks, bone marrow, vegetables, and flavorful broth, is a hearty and delicious soup the whole family will love. Perfect for cold weather!",15 minutes,300 minutes,4,"3 pounds bone-in beef shanks; cold water; 1 large onion, peeled and quartered; 2 tablespoons fish sauce; 1 tablespoon peppercorns; 2 corn, husked and cut into halves; 1 bunch pechay, leaves separated; 2 green onions, stemmed and cut into halves; salt to taste; fish sauce to taste; calamansi juice to taste; Thai chili peppers, chopped","In a large pot, combine beef shanks and enough cold water to cover. Bring to a boil. | Drain beef and rinse under cold water to remove impurities. Discard the liquid and rinse the pot. | In the pot, return meat and enough cold water to cover. Bring to a boil, skimming scum that accumulates on top. | When the broth has cleared, add onions, fish sauce, and peppercorns. | Lower heat, cover, and cook at a bare simmer for about 1 Ã‚Â½ to 2 hours or until meat is fork-tender but not falling apart. | Add corn and simmer for 10 to 15 minutes or until corn is tender. | Add the pechay and green onions and cook for about 2 to 3 minutes or until vegetables are tender. | Season with salt to taste. Serve hot with fish sauce and calamansi.",310,9,49,8,3,1,4,0,80,974,1428,3,4,9429,97,285,7,https://www.kawalingpinoy.com/wp-content/uploads/2013/11/bulalo-5-158x158.jpg,FALSE,FALSE,TRUE,FALSE,TRUE,TRUE,TRUE,FALSE,TRUE
Ginisang Munggo at Sotanghon,"Ginisang Munggo at Sotanghon made extra delicious with cellophane noodles and minced shrimp. It's hearty, budget-friendly and tasty served with steamed rice.",15 minutes,60 minutes,6,"2 ounces sotanghon; 1 cup dried munggo (mung beans), washed and drained; 2 quarts water; 1 tablespoon canola oil; 1 medium onion, peeled and chopped; 3 cloves garlic, peeled and minced; 1 large tomato, chopped; 1 tablespoon fish sauce; pound shrimp, peeled, deveined and cut into -inch pieces; 1 bunch fresh spinach, stems trimmed; salt and pepper to taste","In a bowl, soak sotanghon in warm water for about 1 to 2 minutes or until just softened. Drain well and set aside. | In a pot over medium heat, combine beans and water. Bring to a boil, skimming off the froth that accumulates and beans that float on top. Lower heat, cover and cook for about 1 hour or until beans are softened, and skins have burst. | In another pot over medium heat, heat oil. Add garlic and onions and cook until tender and aromatic. | Add tomatoes and cook, mashing with theÃ‚Â back of a spoon, for about 3 to 5 minutes or until softened and release juice. | Add shrimp and cook for about 1 to 2 minutes or until color changes to pink. | Add fish sauce and continue to cook for about 1 to 2 minutes. | Add cooked mung bean including liquid. Bring to a boil. | Add sotanghon and cook for 3 to 5 minutes or until noodles are translucent. Season with additional salt and pepper to taste. | Add spinach, turn off heat and cover pot for about 1 to 2 minutes or until spinach are just wilted. Serve hot.",238,34,18,3,0,0,0,0,95,597,866,7,3,5525,23,177,5,https://www.kawalingpinoy.com/wp-content/uploads/2018/06/ginisang-munggo-sotanghon-4-158x158.jpg,FALSE,FALSE,TRUE,FALSE,TRUE,TRUE,FALSE,FALSE,TRUE
Kabocha Salad,"This Kabocha Salad is creamy with a hint of sweetness, the perfect side dish for any meal!",45 minutes,20 minutes,6,"1 whole (2 to 3 pounds) kabocha (kalabasa); 1 large carrot, peeled and shredded; 2 tablespoons green onions, chopped; 2 tablespoons raisins; cup mayonnaise; salt and pepper to taste; 2 tablespoons chopped walnuts","Using a sharp knife, cut kabocha into half and scoop out the seeds with a large spoon. Carefully peel the skin and slice the flesh into 1 to 1 Ã‚Â½-inch small chunks. | In a saucepan, place the kabocha and enough water to cover. Bring to a boil and cook until kabocha can be pierced with a fork without resistance but not falling apart. | Drain kabocha well and allow to cool completely. | In a large bowl, place tender kabocha and roughly mash with a fork. | Add shredded carrots, green onions, and raisins. | Add mayonnaise and gently stir to combine. Season with salt and pepper to taste. | Top with chopped walnuts and additional raisins and shredded carrots, if desired. Serve cold.",160,19,2,9,1,0,0,0,3,81,650,3,4,5485,20,52,1,https://www.kawalingpinoy.com/wp-content/uploads/2018/10/Korean-Kabocha-Salad-4-158x158.jpg,TRUE,TRUE,FALSE,TRUE,TRUE,TRUE,TRUE,TRUE,TRUE
Kansi,"Kansi is an Ilonggo sour soup made with beef shanks and green jackfruit, and flavored with batwan or bilimbi. It's a comforting and filling dish perfect for cold weather!",15 minutes,120 minutes,4,"2 pounds beef shanks; 2 stalks lemongrass; 1 tablespoon canola oil; 4 cloves garlic, peeled and minced; 8 cups water; 1 thumb-size ginger, peeled and minced; 1 onion, peeled and quartered; 1 tablespoon annatto powder; 1 package (1.41 ounces) tamarind powder soup base; 1 can (20 ounces) green jackfruit, drained; 8 pieces kamias; 2 Thai chili peppers; salt and pepper to taste","Rinse beef shanks well to remove any blood or impurities. Drain well. | Peel the outer layer of the lemongrass stalks until you reach the pale central core. Cut into 3 to 4-inch lengths and with the back of the knife, lightly pound each piece. Set aside. | In a deep pot over medium heat, heat oil. Add beef shanks and cook, turning as needed, until lightly seared. | Add garlic and cook, stirring regularly, until softened. | Add water and bring to a boil, skimming scum that floats on top. When the broth clears, add onion. | Lower heat, cover, and simmer for about 1 Ã‚Â½ to 2 hours or until meat is fork-tender. | In a small bowl, combine annatto powder with about Ã‚Â½ cup of the broth. Stir until annatto powder is dissolved and return broth to the pot. | Add tamarind soup base. Stir to disperse. | Add lemongrass, green jackfruit, kamias, and chili peppers. Continue to cook for about 10 to 15 minutes or until jackfruit pieces are heated. | Season with salt and pepper to taste. Serve hot.",360,40,31,9,2,1,5,0,53,127,781,2,1,22,8,121,4,https://www.kawalingpinoy.com/wp-content/uploads/2016/09/kansi-2-158x158.jpg,FALSE,FALSE,TRUE,TRUE,TRUE,TRUE,TRUE,TRUE,TRUE
Miswa at Patola Soup,Misua with patola and ground pork is a hearty and flavorful soup that's delicious on its own or as a side dish. Perfect with steamed rice!,10 minutes,20 minutes,4,3 medium patola; 1 tablespoon canola oil; 1 onion; 2 cloves garlic; pound ground pork; 1 tablespoon fish sauce; 2 cups water; 2 ounces miswa noodles; salt and pepper to taste,"Cut off both ends of the patola and discard. Using a vegetable peeler, peel the skin. Slice the peeled gourd crosswise into about Ã‚Â¼-inch thick. | In a wide pan over medium heat, heat oil. Add onions and garlic and cook until softened. | Add pork and cook, breaking apart with the back of a spoon, until lightly browned. | Add fish sauce and continue to cook, stirring occasionally, for about 1 to 2 minutes. | Add water and bring to a boil, skimming any scum that may float on top. | Lower heat and cook for about 10 minutes or until pork is tender. | Add patola and cook for about 3 to 5 minutes or until tender yet crisp. | Add miswa noodles and cook for about 1 to 2 minutes or until softened. | Season with salt and pepper to taste. Serve hot.",271,20,12,16,5,0,0,0,41,430,600,2,5,294,29,47,1,https://www.kawalingpinoy.com/wp-content/uploads/2020/01/miswa-patola-soup-3-158x158.jpg,FALSE,FALSE,FALSE,TRUE,TRUE,TRUE,TRUE,FALSE,FALSE
Sinigang na Salmon Belly sa Kamias,Sinigang na Salmon Belly sa Kamias with flavorfulÃ‚Â fish belly and vegetables in a sour soup is the perfect cold weather comfort food. It's delicious served with steamed rice or enjoyed on its own!,10 minutes,20 minutes,4,"6 cups water; 1 tablespoon fish sauce; 2 cups kamias; 1 small onion, peeled and quartered; 2 medium tomatoes, quartered; 1 banana chili; 1 cup labanos (radish), peeled and cut into chunks; 1 cup long beans, ends trimmed and cut into 3-inch lengths; 1 pound salmon belly, scaled and cut into pieces; 1 eggplant, stemmed and cut into chunks; 4 pieces okra, ends trimmed; salt to taste; 1 bunch bok choy","In a large pot over medium heat, bring water to a boil. Add fish sauce. | Add kamias, onions, tomatoes, and chili pepper. Cook for about 1 to 2Ã‚Â minutes. | Add radish and cook for about 1 to 2 minutes. | Add long beans, eggplant, and okra and continue to cook for 2 to 3 minutes. | Add bok choy and cook for another 1 to 2 minutes. | Add salmon and continue to cook for about 7 to 10 minutes or until fish changes color and flakes easily and vegetables are tender yet crisp. | Season with salt to taste. Serve hot.",243,17,27,7,1,0,0,0,62,607,1539,7,9,9700,111,270,3,https://www.kawalingpinoy.com/wp-content/uploads/2017/07/sinigang-salmon-belly-kamias-2-158x158.jpg,FALSE,FALSE,TRUE,FALSE,TRUE,TRUE,TRUE,FALSE,TRUE
Picadillo,Filipino-style Beef and Chayote soup is easy to make with simple ingredients yet full of flavor. Serve on its own or with steamed rice as a filling and delicious meal.,15 minutes,120 minutes,4,"1 tablespoon canola oil; 1 small onion, peeled and chopped; 2 cloves garlic, peeled and minced; 2 pounds chuck roast, cut into 1 inch cubes; 1 tablespoon fish sauce; 2 large tomatoes, chopped; 3 cups water; 2 pieces chayote, peeled and cut into 1-inch cubes; salt and pepper to taste","In a pot over medium heat, heat oil. Add onions and garlic and cook until softened. | Add beef and cook, stirring occasionally, until no longer pink. | Add fish sauce and continue to cook for about 1 to 2 minutes. | Add tomatoes and cook until softened and begins to release juice. | Add water and bring to a boil. Lower heat, cover and cook for about 1 to 1 Ã‚Â½ hours or until tender. | Add chayote and cook for about 7 to 10 minutes or until tender. | Season with salt and pepper to taste. Serve hot.",351,7,51,11,3,0,0,0,133,1075,1018,1,3,260,11,79,4,https://www.kawalingpinoy.com/wp-content/uploads/2018/06/filipino-picadillo-soup-2-158x158.jpg,FALSE,FALSE,TRUE,FALSE,TRUE,TRUE,TRUE,FALSE,TRUE
Chicken Pochero,"Make Sunday lunch extra special with Chicken Pochero! Chockful of potatoes, saba bananas, chorizo, and vegetables, this classic Filipino stew is hearty, tasty and sure to be a family favorite!",15 minutes,40 minutes,6,"cup canola oil; 3 saba bananas, peeled and halved; 2 medium potatoes, peeled and quartered; 1 onion, peeled and thinly sliced; 2 cloves garlic, peeled and minced; 3 pounds chicken, cut into serving parts; 1 tablespoon fish sauce; 1 cup tomato sauce; 3 cups water; 2 chorizo de bilbao, cut into 1-inch thick pieces; 1 cup garbanzo beans; 12 pieces green beans, ends trimmed; napa cabbage, end trimmed and leaves halved; 1 bunch pechay, ends trimmed and leaves separated; salt and pepper to taste","In a pot over medium heat, heat oil. Add bananas and fry until lightly browned. Remove from pan and drain on paper towels. | Add potatoes and fry until lightly browned. Remove from pan and drain on paper towels. | Remove excess oil except for about 2 tablespoons. Add onions and garlic and cook until softened. | Add chicken and cook, stirring occasionally, until lightly browned and juices run clear. | Add fish sauce and cook for another 1 to 2 minutes. | Add tomato sauce and water and bring to a boil, skimming any scum that accumulates on top. | Lower heat, cover, and cook for about 15 to 20 minutes or until chicken is cooked. | Add potatoes and cook until tender. | Add chorizo de bilbao, garbanzo beans, and bananas. Cook until heated through. | Add green beans and napa cabbage and cook for another 2 to 3 minutes. | Add pechay and cook for about 1 minute or until vegetables are tender yet crisp. Serve hot. | Season with salt and pepper to taste.",853,54,52,50,14,0,0,0,157,1474,1999,14,20,8540,128,348,10,https://www.kawalingpinoy.com/wp-content/uploads/2013/12/chicken-pochero-7-158x158.jpg,FALSE,FALSE,FALSE,FALSE,TRUE,TRUE,TRUE,FALSE,TRUE
Cocido,"Cocido Madrileno is a Spanish hotpot made of fresh and cured meats, a medley of vegetables and sweet fruits, and chickpeas cooked low and slow in well-seasoned stock. It's hearty, tasty, and perfect for holiday or Sunday dinners!",15 minutes,180 minutes,6,"3 tablespoons canola oil; 3 saba bananas, peeled and halved; 1 pound bone-in beef shank; 1 large onion, peeled and quartered; 3 cloves garlic, peeled; 1 teaspoon peppercorns; 8 cups water; 2 teaspoons salt; 5 ounces chorizo de bilbao; 4 ounces ham slices; whole chicken, cut into serving parts; 15 ounces garbanzo beans, drained; 1 head cabbage, quartered; 8 pieces green beans, stemmed; 1 bunch pechay, ends trimmed and leaves separated; 3 eggplants; 3 cloves garlic, peeled and minced; 2 tablespoons vinegar; 1 tablespoon oil; salt to taste","In a pot over medium heat, heat about 1 tablespoon of oil. Add beef shank and cook on both sides until lightly seared. Remove from pot and set aside. | Add water to the pot and bring to a boil. Return beef shanks and continue to boil, skimming scum that floats on top. | When the broth has cleared, add onions, garlic, peppercorns,Ã‚Â and salt. Lower heat, cover, and simmer for about 1 Ã‚Â½ to 2 hours or until meat is tender. | In a wide pan, heat about 1 tablespoon of oil. Add bananas and cook, turning on sides as needed, until lightly browned. Remove from pan and set aside. | Add chorizo de bilbao. Cook, turning as needed, for about 1 to 2 minutes or until chorizo de bilbao releases color. Remove from pot and set aside. | Add another tablespoon of oil if needed. Add chicken and cook, turning on sides, until lightly browned. Remove from pot and drain on paper towels. | Add chicken, ham, and chorizo de bilbao to the pot and cook, skimming scum that floats on top, for about 15 to 20 minutes or until chicken is cooked through. | Add garbanzo beans and saba bananas and cook for about 3 to 5 minutes or until heated through. | Add green beans and cabbage and cook until tender yet crisp. | Add pechay and cook for another 1 minute. Season with additional salt as needed. | To serve, arrange meat and vegetables on a serving platter. Transfer broth into a serving tureen. Serve hot with berenjana sauce. | Over open stove flames, roast eggplant until skins are charred. Under cold running water, peel and discard skins. | In a bowl, mash eggplant. Add garlic, vinegar, oil and salt to taste.",503,42,28,26,6,0,0,0,75,614,1697,14,22,6570,131,270,3,https://www.kawalingpinoy.com/wp-content/uploads/2017/12/cocido-madrileno-158x158.jpg,FALSE,FALSE,FALSE,FALSE,TRUE,TRUE,TRUE,TRUE,FALSE
Sinigang na Inihaw na Liempo,Level up your everyday sinigang! This Sinigang inihaw na liempo is a delicious take on our classic Filipino sour soup using grilled pork belly for a hint of smoky flavor. The perfect comfort food for a chilly day!,15 minutes,30 minutes,6,"2 pounds pork belly, sliced into -thick strips; salt and pepper to taste; 8 cups water; 1 medium onion, peeled and quartered; 2 large tomatoes, quartered; 4 pieces gabi, peeled and halved; 1 (6-inch) radish, peeled and sliced to -inch thick half-rounds; bunch long beans, ends trimmed and cut into 3-inch lengths; 1 eggplant, ends trimmed and sliced to -inch thick half-rounds; 6 pieces okra, ends trimmed; 2 banana or finger chilies; 15 large tamarind pods or 1 packages (1.41 ounces each) tamarind base powder; 1 bunch bok choy, ends trimmed and separated into leaves","Season pork with salt and pepper and marinate for about 10 to 15 minutes. | Grill over hot coals until nicely charred and cooked through, turning on sides as needed. Remove from heat and cut into serving pieces. | In a pot over medium heat, combine pork and water and bring to a boil. | Add onions and tomatoes. Lower heat, cover, and simmer for about 3 to 5 minutes. | Add gabi and cook for about 6 to 8 minutes or until almost tender. | Add radish and cook for about 2 to 3 minutes. | Add long beans. Continue to cook for about 2 minutes. | Add eggplant, okra, and chili peppers. Cook for another 1 to 2 minutes. | If using packaged tamarind base, add to pot and stir until completely dissolved. Season with salt and pepper to taste. | Add bok choy and continue to cook for about 1 minute. Serve hot. | Wash tamarind and place in a pot with 1 cup water. Bring to a boil and cook until soft and outer skins begin to burst. | With a fork, mash tamarinds. In a fine-mesh strainer set over a bowl, pour tamarind and liquid. Continue to mash with a fork, returning some of the liquid into the strainer once or twice, to fully extract the juice. Discard seeds and skins. | Pour tamarind juice into the pot.",852,15,18,81,29,9,37,0,109,172,1099,6,8,6703,87,204,3,https://www.kawalingpinoy.com/wp-content/uploads/2017/02/sinigang-na-inihaw-liempo-3-158x158.jpg,FALSE,FALSE,FALSE,TRUE,TRUE,TRUE,TRUE,TRUE,FALSE
